step,selected_topic,question_id,source,target_difficulty,chosen_difficulty,was_repeat,is_correct,time_taken,time_ratio,effective_ability_before,effective_ability_after,running_accuracy,explanation
0,Flip-flops and registers,T17Q2,bank,5.047,5.0,False,False,37.65,1.087,20.0,19.15,0.0,"The correct answer is B - On the active clock edge because a D flip-flop transfers data from D to Q only when the clock signal changes from low to high (active edge). This ensures that data is latched at specific times, not continuously or randomly. The student was wrong assuming it happened all the time without needing a clock trigger. In a basic explanation: Clock signals are needed to synchronize flip-flops for correct timing in digital systems, hence why they only transfer data during clock edges."
1,Flip-flops and registers,T17Q3,bank,3.979,7.0,False,True,10.94,0.255,19.15,19.7,0.5,"The correct answer is B (""Toggle (complement) its output""). In a JK flip-flop, both J=K=1 results in toggling the output state at each clock pulse. This aligns with how a JK flip-flop operates; when both inputs are high, it acts like an asynchronous set/reset circuit, causing the Q output to toggle between 0 and 1.

The student's choice of B is correct. If they were wrong, a misconception might stem from confusing this with R-S flip-flops where both R=1 and S=1 lead to indeterminate state (race condition), or misunderstanding that in asynchronous circuits outputs can change independently of clock pulses. In synchronous JK flip-flop logic, it toggles output states as per the J=K inputs."
2,Flip-flops and registers,T17Q1,bank,5.549,2.8,False,True,9.97,0.39,19.7,20.15,0.6667,"The correct answer is A because flip-flops are described as memory elements that store one bit of information. They have two outputs, storing either a 0 or 1 at any given time. The other options don't fit: adding binary numbers requires an adder, converting analog to digital uses ADCs and DACs, and amplification is done by amplifiers not flip-flops. So A matches what we learn from the text about how flip-flops work."
3,Flip-flops and registers,T17Q4,bank,5.997,9.1,False,False,24.68,0.385,20.15,19.7,0.5,"The correct answer is B (0000). After four clock cycles, all inputs are shifted out as they are held at 0. The register starts with 1010. In each shift right, previous bits move left and the new bit from serial input replaces the most significant bit (MSB) of the register. Since the serial input is always 0, it continuously overwrites the MSB until all registers become 0. Thus, after four shifts, every bit in the register becomes 0 resulting in 0000. The student likely misunderstood that bits keep shifting without resetting to 0, leading to option A."
4,Temperature sensors,T11Q2,bank,6.013,4.6,False,False,33.35,0.981,19.7,18.95,0.4,"The correct answer is B: A large, nonlinear resistance change (often negative coefficient). Thermistors have a significant temperature-dependent resistance that can be either positive or negative. This means their resistance changes dramatically with temperature unlike RTDs which have mostly linear changes and typically positive coefficients. Thermistors are often used where high sensitivity is required due to their extreme nonlinearity, making them useful for precision temperature measurements despite their nonlinear behavior being the opposite of what's asked in option A. The student was wrong by choosing a small, positive coefficient because that would apply to RTDs, not thermistors."
5,Temperature sensors,T11Q3,bank,4.897,6.6,False,True,7.43,0.18,18.95,19.5,0.5,"The resistance of a Pt100 RTD increases with temperature following R = Ro[1 + alpha*temp]. At 100°C, R = 100(1 + 0.00385*100) = 100 * 1.385 = 138.5 ohms. The student's answer of 138.5 ohm is correct based on the excerpt where it states the resistance increases and uses this equation for a Pt100, matching their calculation accurately."
6,Mechatronic system integration,T44Q2,bank,5.179,6.0,False,True,9.79,0.246,19.5,20.05,0.5714,"The correct answer is A because interpolation allows CNC machines to smoothly transition between programmed points by calculating intermediate set points along a line or arc. This is how they can move accurately and continuously without jerky movements, fitting perfectly with their control function. 

Option B (measuring spindle temperature) is not related to interpolation; C (storing the part program on disk) relates to input rather than motion calculation, while D (filtering mains supply) doesn't apply since it's about power conditioning, not CNC operations. The student’s correct choice reinforces their understanding of CNC controller functions."
7,Operational amplifiers,T02Q2,bank,6.036,5.4,False,True,6.9,0.192,20.05,20.6,0.625,"The output voltage of an inverting amplifier can be calculated using the formula: Vout = - (Vin * Rf / Rin). Given Vin = 0.2V, Rf = 50kΩ, and Rin = 10kΩ:

Vout = -(0.2 * 50k/10k) = -1V

The correct answer is A (""-1.0 V"") because the negative sign indicates inversion of input voltage at the output. The student's choice was correct. Misconceptions might arise from confusing with non-inverting amplifiers, where outputs are not inverted and have positive signs."
8,Block diagram and signal flow,T19Q2,bank,7.161,5.2,False,False,8.77,0.247,20.6,20.15,0.5556,"The correct answer is A: G/(1 + GH). The equation comes from system analysis where for a negative feedback loop, you add 1 to the product of G and H (GH) in the denominator. This accounts for how feedback reduces the overall gain by making the denominator larger, lowering the gain at the output. Your B answer subtracts GH instead, which would make sense for positive feedback but not for negative feedback where we want to reduce gain. Think about it as adding a resistance to a circuit - if you add more resistance (1 + GH), that makes the overall path harder to pass through, reducing flow (gain)."
9,Mechatronic system integration,T44Q1,bank,6.323,3.8,False,True,66.15,2.175,20.15,19.65,0.6,"The correct answer is A because position/velocity sensors (like encoders) on each axis provide feedback to ensure precise motion control. Encoders measure actual tool or workpiece positions, allowing for adjustments when there's a discrepancy with intended movement. Without these sensors, the CNC wouldn't know if it reached the right spot or how much error occurred, making A the only feasible choice among given options that uses sensor feedback for control."
10,Number systems and digital coding,LLM_Number_systems_and_d_058,llm,5.813,5.81,False,False,40.94,1.067,19.65,18.8,0.5455,"The correct answer is D (Hexadecimal). Hexadecimal is particularly suited for micro-computers as mentioned in the excerpt stating ""Hexadecimal number system is particularly suited for microcomputers."" This aligns with the advantage of Hexadecimal having fewer digits than Binary, making it easier to read, record, and print. The student was mistaken by choosing B (Binary) because binary numbers are not specifically highlighted for ease of reading and recording in this context. Octal systems were mentioned as advantageous in digital work due to less circuitry but not for microcomputers. Decimal's advantage is for representing quantities outside the digital system. Hexadecimal’s smaller digit set makes it more convenient for these tasks, unlike binary which has a longer number representation for small values like 8 or 16."
11,Block diagram and signal flow,T19Q1,bank,4.583,3.0,False,True,4.84,0.186,18.8,19.35,0.5833,"The correct transfer function for cascaded blocks G1 and G2 is indeed their multiplication (G1 x G2). This aligns with point (l) from Excerpt 1, which states that ""the product of transfer functions of forward path and feedback path G(s) × H(s), sometimes expressed as GH(s),"" is used in the context of cascaded systems. Cascading means connecting blocks sequentially; each output becomes the input to the next block. Therefore, for two cascaded blocks, their individual transfer functions are multiplied together to find the overall system's transfer function. The student’s choice was correct."
12,Mechatronic system integration,T44Q3,bank,5.185,8.0,False,True,33.33,0.636,19.35,19.7,0.6154,"The correct answer is A because the excerpt states that fieldbus systems like CAN and PROFIBUS enable robust digital communication among distributed controllers, sensors, and actuators using just a few wires. This directly relates to how they provide efficient data exchange in an integrated system. Option B about supplying power, C about replacing mechanical parts, and D about cooling are not mentioned or implied by the excerpt as functions of fieldbus systems. The student's choice reflects understanding that these bus systems facilitate communication among components without needing many wires for each device, which aligns with how they're used in modern integrated mechatronic systems."
13,Mechatronic system integration,T44Q4,bank,6.181,9.5,False,True,19.32,0.266,19.7,20.25,0.6429,"The correct answer is B because matched dynamic responses/bandwidths across axes ensure consistent control performance among servo loops. Synchronized set points maintain coordinated movement towards target positions. These matched parameters prevent one axis from overshooting or lagging others, minimizing contour errors typical in multi-axis systems.

Option A is wrong as different bandwidths would lead to inconsistent system behavior and error accumulation. Option C, removing feedback, defeats the purpose of servo control by losing essential feedback mechanisms for error correction. Running open-loop (option D) is unacceptable since it lacks stability and response accuracy needed for precision motion control."
14,Operational amplifiers,T02Q3,bank,6.792,7.2,False,True,13.2,0.298,20.25,20.8,0.6667,"The op-amp's gain-bandwidth product (GBWP) is 1 MHz. For a non-inverting amplifier with a gain of 100, the closed-loop bandwidth (ωcl) can be approximated using GBWP = ωcl × Gain. Rearranging gives ωcl = GBWP / Gain. Substituting values: ωcl ≈ 1 MHz / 100 = 10 kHz.

The student's answer C, ""10 kHz"", is correct because they applied the formula accurately for a non-inverting amplifier configuration with gain 100. The misconception likely lay in thinking about how to calculate closed-loop bandwidth directly from GBWP alone without considering the gain factor."
15,Block diagram and signal flow,T19Q3,bank,7.438,7.2,False,True,3.98,0.089,20.8,21.35,0.6875,"The correct answer A is right because Mason's gain formula allows finding the overall gain of a signal-flow graph directly by calculating contributions from forward paths and loops. This simplifies complex systems into manageable parts for analysis, which aligns with the block diagram reduction techniques mentioned in the excerpts.

Explanation doesn't need elaborating on options B, C, or D as they are clearly unrelated to Mason's formula based on the provided information. The student was correct by identifying A, and it directly corresponds to the signal flow graph simplification methods discussed, such as using GH(s) for forward and feedback paths and understanding character equations like 1+GH=0."
16,Block diagram and signal flow,T19Q4,bank,7.715,9.0,False,False,18.75,0.302,21.35,20.9,0.6471,"The closed-loop pole occurs at -2 + j0 where G(s) * H(s) = 0. Here, G(s) = 20/(s+2). For unity feedback (H(s) = 1), the transfer function becomes 20/((s+2)(s+2)) = 20/(s^2 + 4s + 4). Setting this equal to zero for poles: s^2 + 4s + 4 = 0, solving gives s = -2 ± j√(16-16)/2. The correct pole location is thus -2 with a complex conjugate pair due to feedback effect, resulting in s = -22 (real part) and s = -2+/-j as imaginary parts. Student likely confused the real part alone for the answer, not considering the full closed-loop characteristic equation."
17,Temperature sensors,T11Q4,bank,6.769,8.8,False,True,336.52,5.456,20.9,19.95,0.6667,"The correct answer is B because using a 3- or 4-wire connection allows for the lead wire resistances to be measured and subtracted from the total resistance readings, thus cancelling out their effect on temperature measurements. This precision correction mitigates errors caused by lead wire resistance, unlike options involving increasing current, adding a thermistor in series (which would not cancel), or doubling RTD resistance, all of which don't address lead resistance issues effectively."
18,Operational amplifiers,T02Q1,bank,4.945,3.2,False,True,5.49,0.187,19.95,20.5,0.6842,"The correct answer is B because for an ideal op-amp with negative feedback, no current should flow into inputs (no current into inputs rule). This keeps input voltages equal to ground (virtual short), which ensures maximum gain and stability.

Student's option A was incorrect as it talks about infinite output current and zero gain - these are not golden rules. Option C is wrong because op-amps have finite currents at inputs, and D is absurd since outputs follow the difference between inputs. The virtual short concept stabilizes amplifiers by making input voltages equal, crucial for signal integrity and stability in op-amp circuits."
19,Counters and timers,T26Q2,bank,5.472,5.0,False,True,4.74,0.133,20.5,21.05,0.7,"The correct answer is B because ripple counters propagate state changes through individual flip-flops one at a time, leading to cumulative delays which cause glitches at high speeds. Synchronous counters address this by operating all flip-flops simultaneously on the clock signal. This eliminates output glitches and ensures consistent timing. The student's choice of B highlights understanding of how propagation delays affect performance in asynchronous circuits versus synchronous ones. Misconceptions about options like counting up or down, inability to count at all, or no need for a clock are not supported by the provided excerpts."
